{
  "sweep_id": "sweep_h4_s3_tool_any_v1",
  "hazard_id": "H4",
  "severity_id": "S3",
  "context_class": "tool_access:any",
  "oversight_levels_tested": [
    100,
    500,
    1000
  ],
  "eval_run_ids": [
    "evalrun_2025_01_15"
  ],
  "eval_run_hashes": {
    "evalrun_2025_01_15": "sha256:d453d8d95a60fe6741d64b003796fb6864765299561c7e0c3bee03f84244a4c8"
  },
  "rfc_reference": "RFC-SWEEP-0001",
  "approvals": [
    {
      "role": "Risk Modeling Lead",
      "signature": "sig_sweep_v1",
      "timestamp": "2025-01-16T02:00:00Z"
    }
  ],
  "fitting_inputs_hash": "sha256:34d6bb168081efe671739316b6a8db8ea99a155229b13f5006598a5bbacec4fa",
  "generated_at": "2025-01-16T00:00:00Z",
  "generator_commit": "HEAD"
}