{
  "sweep_id": "sweep_h2_s3_tools_v1",
  "hazard_id": "H2",
  "severity_id": "S3",
  "context_class": "tool_access:web+email",
  "oversight_levels_tested": [
    100,
    500,
    1000
  ],
  "eval_run_ids": [
    "evalrun_2025_01_15"
  ],
  "eval_run_hashes": {
    "evalrun_2025_01_15": "sha256:d453d8d95a60fe6741d64b003796fb6864765299561c7e0c3bee03f84244a4c8"
  },
  "rfc_reference": "RFC-SWEEP-0001",
  "approvals": [
    {
      "role": "Risk Modeling Lead",
      "signature": "sig_sweep_v1",
      "timestamp": "2025-01-16T02:00:00Z"
    }
  ],
  "fitting_inputs_hash": "sha256:218dc5eeee3de8b366408a207ce768090bb9ebaa7e63376ae54b89836c789a54",
  "generated_at": "2025-01-16T00:00:00Z",
  "generator_commit": "HEAD"
}